{
  "schemaVersion": 1,
  "contractRevision": "zb-zp-contract-0.2-draft",
  "eventId": "00000000-0000-4000-8000-0000000e0017",
  "accountId": "00000000-0000-4000-8000-0000000a0001",
  "sourceApp": "zpet",
  "sourceDeviceId": "00000000-0000-4000-8000-0000000d0001",
  "recordType": "BattleCompleted",
  "recordId": "00000000-0000-4000-8000-0000000b0004",
  "recordRevision": 1,
  "createdAtUtc": "2026-10-10T04:00:00Z",
  "payload": {
    "battleId": "00000000-0000-4000-8000-0000000b0004",
    "encounterId": "area-00/slot-0",
    "encounterKind": "wild",
    "groupId": "group-0",
    "areaId": "area-00",
    "participantCompanionIds": [
      "00000000-0000-4000-8000-0000000c0001"
    ],
    "outcome": "victory",
    "rulesRevision": "zbattle-rules-1",
    "verification": "unverified-client",
    "settlementRef": null
  }
}
