{
  "schemaVersion": 1,
  "contractRevision": "zb-zp-contract-0.2-draft",
  "eventId": "00000000-0000-4000-8000-0000000e0004",
  "accountId": "00000000-0000-4000-8000-0000000a0001",
  "sourceApp": "zpet",
  "sourceDeviceId": "00000000-0000-4000-8000-0000000d0001",
  "recordType": "CompanionSnapshot",
  "recordId": "00000000-0000-4000-8000-0000000c0003",
  "recordRevision": 1,
  "createdAtUtc": "2026-10-10T04:00:00Z",
  "payload": {
    "companionId": "00000000-0000-4000-8000-0000000c0003",
    "originApp": "zpet",
    "legacyLocalId": "pet-2",
    "speciesId": "4:1",
    "formIndex": 0,
    "branch": "none",
    "nickname": null,
    "elementId": null,
    "provenance": "imported",
    "sourceRevision": 1,
    "bondPercent": null,
    "bondRevision": null
  }
}
