{
  "schemaVersion": 1,
  "contractRevision": "zb-zp-contract-0.2-draft",
  "eventId": "00000000-0000-4000-8000-0000000e0032",
  "accountId": "00000000-0000-4000-8000-0000000a0001",
  "sourceApp": "zbattle",
  "sourceDeviceId": "00000000-0000-4000-8000-0000000d0002",
  "recordType": "BossState",
  "recordId": "boss/fixture-only",
  "recordRevision": 1,
  "createdAtUtc": "2026-10-10T04:00:00Z",
  "payload": {
    "bossId": "boss/fixture-only",
    "nextEligibleAtUtc": "2026-10-10T08:00:00Z",
    "windowStartAtUtc": "2026-10-10T04:00:00Z",
    "victoryTimestampsUtc": [
      "2026-10-10T04:00:00Z"
    ],
    "victoryCount": 1,
    "settlementIds": [
      "00000000-0000-4000-8000-00000005e001"
    ],
    "rewardState": "settled"
  }
}
